{
  "schema_version": "ded-identification-result-v1",
  "identification_stage": "playback_point_v1",
  "identified_status": "heat_accumulation_warning",
  "status_label": "熱累積警示",
  "status_confidence": 0.71,
  "status_source": [
    "thermal.G_High",
    "edge.machine_z_mm",
    "toolpath.feed_rate_mm_min",
    "laser_on_window"
  ],
  "status_reason": "目前播放點的 G_High 進入警示區間，且位於有效沉積區間，推定為熱輸入偏高或冷卻不足。",
  "status_evidence": {
    "g_high": 1325.4,
    "layer_index": 1,
    "timestamp_ms": 1748133128219,
    "x_mm": 21.87,
    "y_mm": -24.98,
    "z_mm": 109.982,
    "laser_on": true,
    "feed_rate_mm_min": 566
  },
  "time_context": {
    "source": "heat_playback",
    "playback_progress": 0.37,
    "time_label": "10:32:08.219"
  }
}
